city,state,tier,cost_mult,labour_mult,cement,sand,brick,aggregate,steel,verified,last_updated,source_label,source_url,notes
agra,Uttar Pradesh,2,1.02,0.98,395,65,9,42,60,false,2026-04-10,regional-band UP Tier-2 (anchored to Lucknow live),,Inferred from Lucknow live data minus 2% cost differential. Cement 380-410 range; steel 57-63/kg; brick 8-10/nos.
ahmedabad,Gujarat,1,1.15,1.10,385,58,7,40,55,true,2026-04-10,todaypricerates.com April 2026,https://property.todaypricerates.com/construction-building-materials-rate-in-ahmedabad,Live April 2026. Cement OPC53 avg Rs 385 (range 360-410); steel Fe500 avg Rs 55/kg (52000-58000/ton); brick red clay avg Rs 7 (5-9/nos); sand Rs 58/cft (M-sand 1200-1700/ton converted); aggregate Rs 40/cft (20mm 1150-1600/ton).
amritsar,Punjab,2,1.05,1.02,390,68,11,48,64,false,2026-04-10,regional-band Punjab Tier-2 (anchored to Chandigarh/Ludhiana),,Inferred from Punjab regional band. Cement 370-410; steel 60-68/kg; brick 10-13/nos; sand 55-80/cft; aggregate 40-55/cft.
aurangabad,Maharashtra,2,1.02,1.00,375,60,9,43,61,false,2026-04-10,regional-band Maharashtra Tier-2,,Inferred from Pune live data minus Tier-2 differential. Cement 355-395; steel 57-65/kg; brick 8-11/nos.
bangalore,Karnataka,1,1.30,1.35,380,68,12,52,65,false,2026-04-10,buildmaadi.com + todaypricerates March-April 2026,https://www.buildmaadi.com/cement-price-in-bangalore/,Cement range Rs 355-405 avg Rs 380; steel Fe500 average Rs 65/kg from buildmaadi March 2026 brand list; brick wirecut avg Rs 12/nos. Sand/aggregate estimated from South India regional band (Karnataka quarry prices).
bhopal,Madhya Pradesh,1,1.02,0.99,370,60,10,43,62,false,2026-04-10,regional-band MP Tier-1,,Inferred from Indore live data +5% state capital premium. Cement 350-390; steel 58-66/kg; brick 9-12/nos.
bhubaneswar,Odisha,1,1.05,1.02,380,60,10,43,65,false,2026-04-10,regional-band Odisha Tier-1,,Inferred from East India regional band. Cement 360-400; steel 62-68/kg; brick 9-12/nos.
chandigarh,Punjab,1,1.20,1.18,390,68,11,48,64,false,2026-04-10,regional-band Punjab Tier-1,,Inferred from Punjab regional band. Cement 370-410; steel 60-68/kg; brick 10-13/nos.
chennai,Tamil Nadu,1,1.05,1.05,410,73,8,45,61,true,2026-04-10,todaypricerates.com April 2026,https://property.todaypricerates.com/construction-building-materials-rate-in-Chennai,Live April 2026. Cement OPC53 avg Rs 410 (380-440); steel Fe500 avg Rs 61/kg (58000-64000/ton); brick red clay avg Rs 8 (6-10/nos); sand M-sand Rs 73/cft (avg 1400-1900/ton); aggregate 20mm Rs 45/cft (1300-1700/ton midpoint).
coimbatore,Tamil Nadu,2,0.92,0.90,370,62,10,40,62,false,2026-04-10,regional-band TN Tier-2 (anchored to Chennai live),,Inferred from Chennai live minus 10% Tier-2 differential. Cement 350-390; steel 59-65/kg; brick 9-11/nos.
cuttack,Odisha,2,0.98,0.95,375,58,9,42,64,false,2026-04-10,regional-band Odisha Tier-2,,Inferred from Bhubaneswar band. Cement 355-395; steel 60-68/kg; brick 8-10/nos.
dehradun,Uttarakhand,2,1.10,1.08,400,68,10,48,68,false,2026-04-10,regional-band Uttarakhand Tier-2,,Hill state premium. Cement 380-420; steel 64-72/kg; brick 9-12/nos. Higher transport adds 5-8% premium.
delhi,Delhi,1,1.42,1.45,410,78,8,50,65,true,2026-04-10,todaypricerates.com April 2026,https://property.todaypricerates.com/construction-building-materials-rate-in-New-Delhi,Live April 2026. Cement OPC53 avg Rs 410 (380-440); steel Fe500 avg Rs 65/kg (62000-68000/ton); brick red clay avg Rs 8 (6-11/nos); sand river avg Rs 78/cft (1500-2000/ton); aggregate 20mm Rs 50/cft (1400-1900/ton).
durgapur,West Bengal,2,1.02,1.00,380,65,10,44,63,false,2026-04-10,regional-band WB Tier-2 (anchored to Kolkata live),,Inferred from Kolkata live data minus Tier-2 differential.
erode,Tamil Nadu,3,0.86,0.83,355,52,8,35,58,false,2026-04-10,regional-band TN Tier-3,,Inferred from TN Tier-3 band. Cement 335-375; steel 54-62/kg; brick 7-9/nos.
faridabad,Haryana,2,1.22,1.25,405,78,11,52,66,false,2026-04-10,regional-band Delhi-NCR Tier-2,,Inferred from Delhi live data with NCR Tier-2 differential. Cement 385-425; steel 62-70/kg; brick 10-14/nos.
ghaziabad,Uttar Pradesh,2,1.25,1.28,405,78,11,52,66,false,2026-04-10,regional-band Delhi-NCR Tier-2,,Inferred from Delhi live data with NCR Tier-2 differential.
gorakhpur,Uttar Pradesh,2,0.97,0.95,390,65,9,42,60,false,2026-04-10,regional-band UP Tier-2,,Inferred from UP regional band. Cement 370-410; steel 56-64/kg; brick 8-10/nos.
guntur,Andhra Pradesh,2,1.00,0.98,380,60,9,42,62,false,2026-04-10,regional-band AP Tier-2,,Inferred from Vijayawada/Hyderabad AP regional band.
gurgaon,Haryana,1,1.43,1.46,405,78,11,52,66,false,2026-04-10,regional-band Delhi-NCR Tier-1,,Inferred from Delhi live data with NCR premium. Cement 385-425; steel 62-70/kg.
guwahati,Assam,1,1.12,1.10,385,65,10,45,67,false,2026-04-10,regional-band NE India Tier-1,,NE India premium for logistics. Cement 365-405; steel 63-71/kg; brick 9-12/nos.
howrah,West Bengal,1,1.15,1.12,395,65,10,44,63,false,2026-04-10,regional-band WB Tier-1 (anchored to Kolkata live),,Inferred from Kolkata live data +2% location premium.
hubli,Karnataka,2,1.00,0.97,375,62,10,45,64,false,2026-04-10,regional-band Karnataka Tier-2,,Inferred from Bangalore band minus Tier-2 differential.
hyderabad,Telangana,1,1.22,1.24,415,60,8,42,61,true,2026-04-10,todaypricerates.com April 2026,https://property.todaypricerates.com/construction-building-materials-rate-in-Hyderabad,Live April 2026. Cement OPC53 avg Rs 415 (390-440); steel Fe500 avg Rs 61/kg (58000-64000/ton); brick red clay avg Rs 8 (6-10/nos). Sand per ton pricing converted: river sand avg Rs 60/cft; aggregate 20mm Rs 42/cft.
indore,Madhya Pradesh,1,1.05,1.02,380,60,11,43,58,false,2026-04-10,todaypricerates.com April 2026 (prior cycle),https://property.todaypricerates.com/construction-building-materials-rate-in-Indore,Sourced from todaypricerates earlier 2026 cycle. Cement avg Rs 374 updated to Rs 380; brick Rs 12; steel Rs 57-59/kg avg Rs 58.
jabalpur,Madhya Pradesh,2,0.96,0.93,365,58,10,42,60,false,2026-04-10,regional-band MP Tier-2,,Inferred from Indore/Bhopal regional band minus Tier-2 differential.
jaipur,Rajasthan,1,1.10,1.07,405,62,7,43,60,true,2026-04-10,todaypricerates.com April 2026,https://property.todaypricerates.com/construction-building-materials-rate-in-Jaipur,Live April 2026. Cement OPC53 avg Rs 405 (380-430); steel Fe500 avg Rs 60/kg (58000-63000/ton); brick red clay avg Rs 7 (6-9/nos); sand river avg Rs 62/cft (1000-1500/ton); aggregate 20mm Rs 43/cft (1100-1600/ton).
jodhpur,Rajasthan,2,0.98,0.96,390,60,8,40,58,false,2026-04-10,regional-band Rajasthan Tier-2,,Inferred from Jaipur live data minus Tier-2 differential.
kanpur,Uttar Pradesh,1,1.05,1.02,395,65,9,42,60,false,2026-04-10,regional-band UP Tier-1,,Inferred from UP regional band anchored to Lucknow live.
kochi,Kerala,1,1.22,1.28,395,72,12,52,67,false,2026-04-10,regional-band Kerala Tier-1,,Kerala higher sand/labour costs. Cement 375-415; steel 63-71/kg; brick 10-14/nos; sand 60-85/cft (river sand scarce).
kolkata,West Bengal,1,1.18,1.15,400,65,8,43,63,true,2026-04-10,todaypricerates.com April 2026,https://property.todaypricerates.com/construction-building-materials-rate-in-Kolkata,Live April 2026. Cement OPC53 avg Rs 400 (370-430); steel Fe500 avg Rs 63/kg (60000-66000/ton); brick red clay avg Rs 8 (6-10/nos); sand river avg Rs 65/cft (1400-1900/ton); aggregate 20mm Rs 43/cft (1350-1850/ton).
kozhikode,Kerala,2,1.12,1.16,390,70,12,50,66,false,2026-04-10,regional-band Kerala Tier-2,,Inferred from Kochi band minus Tier-2 differential.
lucknow,Uttar Pradesh,1,1.10,1.08,405,65,9,47,60,true,2026-04-10,todaypricerates.com April 2026,https://property.todaypricerates.com/construction-building-materials-rate-in-Lucknow,Live April 2026. Cement OPC53 avg Rs 405 (380-430); steel Fe500 avg Rs 60/kg (57000-63000/ton); brick red clay avg Rs 9 (6-12/nos); sand river avg Rs 65/cft (1500-2000/ton); aggregate 20mm Rs 47/cft (1450-1900/ton).
ludhiana,Punjab,1,1.12,1.10,388,68,11,48,64,false,2026-04-10,regional-band Punjab Tier-1,,Inferred from Punjab band. Cement 368-408; steel 60-68/kg; brick 10-13/nos.
madurai,Tamil Nadu,2,0.90,0.87,368,58,9,38,60,false,2026-04-10,regional-band TN Tier-2,,Inferred from TN band minus Tier-2 differential. Cement 348-388; steel 56-64/kg.
mangalore,Karnataka,2,1.04,1.00,378,65,11,47,64,false,2026-04-10,regional-band Karnataka Tier-2 (coastal premium),,Coastal Karnataka slight premium for transport. Cement 358-398; steel 60-68/kg.
meerut,Uttar Pradesh,2,1.10,1.08,400,68,9,44,62,false,2026-04-10,regional-band UP Tier-2 (near Delhi),,Inferred from Delhi-NCR proximity pricing.
mumbai,Maharashtra,1,1.47,1.52,450,88,15,60,67,true,2026-04-10,todaypricerates.com April 2026,https://property.todaypricerates.com/construction-building-materials-rate-in-mumbai,Live April 2026. Cement OPC53 avg Rs 450 (420-480); steel Fe500 avg Rs 67/kg (64000-70000/ton); brick red clay avg Rs 15 (12-18/nos); M-sand avg Rs 88/cft (4500-5500/ton - very high due to river sand ban); aggregate 20mm Rs 60/cft (1600-2000/ton). Highest cost city.
mysore,Karnataka,2,1.06,1.02,375,62,10,44,64,false,2026-04-10,regional-band Karnataka Tier-2,,Inferred from Bangalore band minus differential.
nagpur,Maharashtra,2,1.06,1.03,385,62,11,43,61,false,2026-04-10,todaypricerates.com (prior cycle),https://property.todaypricerates.com/construction-building-materials-rate-in-Nagpur,Sourced from earlier 2026 cycle. Cement avg Rs 344 updated to Rs 385 (Apr 2026 trend +12%); steel Rs 61/kg; brick Rs 12.
nashik,Maharashtra,2,1.10,1.07,390,62,9,44,62,false,2026-04-10,regional-band Maharashtra Tier-2,,Inferred from Pune live data with Nashik differential.
noida,Uttar Pradesh,1,1.38,1.40,407,80,11,52,66,false,2026-04-10,regional-band Delhi-NCR Tier-1,,Inferred from Delhi live data with NCR Noida differential.
patna,Bihar,2,1.00,0.98,395,62,7,43,59,false,2026-04-10,todaypricerates.com Bihar (prior cycle),https://property.todaypricerates.com/Bihar-construction-building-materials-rate,Prior cycle patna data updated per April 2026 trend. Cement Rs 395 (was 385); steel Rs 59/kg; brick Rs 7 avg.
pune,Maharashtra,1,1.27,1.30,405,68,8,43,59,true,2026-04-10,todaypricerates.com April 2026,https://property.todaypricerates.com/construction-building-materials-rate-in-Pune,Live April 2026. Cement OPC53 avg Rs 405 (380-430); steel Fe500 avg Rs 59/kg (57000-61000/ton); brick red clay avg Rs 8 (7-10/nos); M-sand widely used - aggregate 20mm avg Rs 43/cft (1100-1500/ton); sand avg Rs 68/cft (regulated river sand).
rajkot,Gujarat,2,1.03,1.00,378,55,9,38,56,false,2026-04-10,regional-band Gujarat Tier-2,,Inferred from Ahmedabad live minus Tier-2 differential.
ranchi,Jharkhand,2,1.00,0.98,375,60,9,42,62,false,2026-04-10,regional-band Jharkhand Tier-2,,Inferred from East India regional band.
raipur,Chhattisgarh,2,0.98,0.96,365,58,9,40,60,false,2026-04-10,regional-band CG Tier-2,,Central India Tier-2 band. Cement 345-385; steel 56-64/kg.
salem,Tamil Nadu,2,0.88,0.85,360,52,8,36,59,false,2026-04-10,regional-band TN Tier-2,,Inferred from TN band minus Tier-2 differential.
shimla,Himachal Pradesh,2,1.15,1.12,415,82,12,55,70,false,2026-04-10,regional-band HP Tier-2 (hill premium),,Hill state logistics premium 10-15%. Cement 395-435; steel 66-74/kg.
srinagar,Jammu and Kashmir,2,1.18,1.15,430,90,13,60,74,false,2026-04-10,regional-band JK Tier-2 (high logistics),,Highest logistics cost (mountains + border). Cement 410-450; steel 70-78/kg; brick 12-15/nos; sand 80-100/cft.
surat,Gujarat,1,1.14,1.12,380,58,10,42,57,false,2026-04-10,regional-band Gujarat Tier-1 (anchored to Ahmedabad),,Surat slightly higher than Ahmedabad for coastal transport. Cement 360-400; steel 54-60/kg.
thiruvananthapuram,Kerala,1,1.18,1.22,395,72,12,52,67,false,2026-04-10,regional-band Kerala Tier-1,,Inferred from Kerala band. Cement 375-415; steel 63-71/kg; brick 10-14/nos.
thoothukudi,Tamil Nadu,3,0.85,0.82,352,50,8,35,57,false,2026-04-10,regional-band TN Tier-3,,TN Tier-3 lowest band. Cement 332-372; steel 54-60/kg.
tirunelveli,Tamil Nadu,3,0.85,0.82,352,50,8,35,57,false,2026-04-10,regional-band TN Tier-3,,TN Tier-3 lowest band. Cement 332-372; steel 54-60/kg.
trichy,Tamil Nadu,2,0.89,0.86,362,54,9,37,59,false,2026-04-10,regional-band TN Tier-2,,Inferred from TN band. Cement 342-382; steel 55-63/kg.
udaipur,Rajasthan,2,1.00,0.97,392,60,8,40,58,false,2026-04-10,regional-band Rajasthan Tier-2,,Inferred from Jaipur live minus differential. Cement 372-412; steel 55-61/kg.
vadodara,Gujarat,2,1.06,1.03,382,58,10,42,56,false,2026-04-10,regional-band Gujarat Tier-2,,Inferred from Ahmedabad live. Cement 362-402; steel 53-59/kg.
varanasi,Uttar Pradesh,2,0.98,0.96,390,65,9,43,60,false,2026-04-10,regional-band UP Tier-2,,Inferred from UP band anchored to Lucknow. Cement 370-410; steel 56-64/kg.
vellore,Tamil Nadu,3,0.86,0.83,355,50,8,35,58,false,2026-04-10,regional-band TN Tier-3,,Inferred from TN Tier-3 band.
vijayawada,Andhra Pradesh,2,1.06,1.03,380,60,9,43,62,false,2026-04-10,regional-band AP Tier-2,,Inferred from Hyderabad live minus AP Tier-2 differential.
visakhapatnam,Andhra Pradesh,1,1.12,1.10,385,62,10,44,63,false,2026-04-10,regional-band AP Tier-1,,Inferred from Hyderabad live. Coastal AP slight premium.
warangal,Telangana,2,1.00,0.97,395,58,8,42,62,false,2026-04-10,regional-band Telangana Tier-2 (anchored to Hyderabad live),,Inferred from Hyderabad live minus Tier-2 differential.
